{
  "schema": "nagare-source-health/v1",
  "generatedAt": "2026-10-09T11:40:11Z",
  "mode": "fixture",
  "summary": {
    "total": 92,
    "healthy": 6,
    "degraded": 12,
    "unavailable": 0,
    "interactiveRequired": 0,
    "disabled": 74
  },
  "sources": [
    {
      "id": "1ani",
      "name": "1ANI",
      "kind": "web",
      "tier": 2,
      "version": "1.4",
      "status": "disabled",
      "durationMs": 0,
      "category": "source_disabled",
      "message": "source is disabled"
    },
    {
      "id": "233dm",
      "name": "233dm",
      "kind": "web",
      "tier": 2,
      "version": "1.0",
      "status": "disabled",
      "durationMs": 0,
      "category": "source_disabled",
      "message": "source is disabled"
    },
    {
      "id": "295yhw",
      "name": "295yhw",
      "kind": "web",
      "tier": 2,
      "version": "1.0",
      "status": "disabled",
      "durationMs": 0,
      "category": "source_disabled",
      "message": "source is disabled"
    },
    {
      "id": "7sefun",
      "name": "7sefun",
      "kind": "web",
      "tier": 2,
      "version": "1.3",
      "status": "degraded",
      "durationMs": 0,
      "category": "unsupported_rule",
      "message": "source has no self-test request"
    },
    {
      "id": "80tv",
      "name": "80tv",
      "kind": "web",
      "tier": 2,
      "version": "1.0",
      "status": "disabled",
      "durationMs": 0,
      "category": "source_disabled",
      "message": "source is disabled"
    },
    {
      "id": "9ciyuan",
      "name": "9ciyuan",
      "kind": "web",
      "tier": 2,
      "version": "1.3",
      "status": "disabled",
      "durationMs": 0,
      "category": "source_disabled",
      "message": "source is disabled"
    },
    {
      "id": "aafun",
      "name": "aafun",
      "kind": "web",
      "tier": 2,
      "version": "1.2",
      "status": "degraded",
      "durationMs": 0,
      "category": "unsupported_rule",
      "message": "source has no self-test request"
    },
    {
      "id": "acg",
      "name": "ACG.RIP",
      "kind": "bt",
      "tier": 3,
      "version": "1",
      "status": "healthy",
      "durationMs": 0
    },
    {
      "id": "age",
      "name": "AGE",
      "kind": "web",
      "tier": 2,
      "version": "1.5",
      "status": "degraded",
      "durationMs": 0,
      "category": "unsupported_rule",
      "message": "source has no self-test request"
    },
    {
      "id": "akianime",
      "name": "akianime",
      "kind": "web",
      "tier": 2,
      "version": "1.4",
      "status": "degraded",
      "durationMs": 0,
      "category": "unsupported_rule",
      "message": "source has no self-test request"
    },
    {
      "id": "anfuns",
      "name": "AnFuns",
      "kind": "web",
      "tier": 2,
      "version": "0.1",
      "status": "disabled",
      "durationMs": 0,
      "category": "source_disabled",
      "message": "source is disabled"
    },
    {
      "id": "anime7",
      "name": "anime7",
      "kind": "web",
      "tier": 2,
      "version": "1.0",
      "status": "disabled",
      "durationMs": 0,
      "category": "source_disabled",
      "message": "source is disabled"
    },
    {
      "id": "ant",
      "name": "ant",
      "kind": "web",
      "tier": 2,
      "version": "0.0.2",
      "status": "disabled",
      "durationMs": 0,
      "category": "source_disabled",
      "message": "source is disabled"
    },
    {
      "id": "aowu",
      "name": "aowu",
      "kind": "web",
      "tier": 2,
      "version": "2.0",
      "status": "disabled",
      "durationMs": 0,
      "category": "source_disabled",
      "message": "source is disabled"
    },
    {
      "id": "baimao",
      "name": "baimao",
      "kind": "web",
      "tier": 2,
      "version": "1.0",
      "status": "degraded",
      "durationMs": 0,
      "category": "unsupported_rule",
      "message": "source has no self-test request"
    },
    {
      "id": "bf",
      "name": "BF",
      "kind": "web",
      "tier": 2,
      "version": "1.1",
      "status": "disabled",
      "durationMs": 0,
      "category": "source_disabled",
      "message": "source is disabled"
    },
    {
      "id": "bobodm",
      "name": "bobodm",
      "kind": "web",
      "tier": 2,
      "version": "1.0",
      "status": "disabled",
      "durationMs": 0,
      "category": "source_disabled",
      "message": "source is disabled"
    },
    {
      "id": "brovod",
      "name": "brovod",
      "kind": "web",
      "tier": 2,
      "version": "1.1",
      "status": "disabled",
      "durationMs": 0,
      "category": "source_disabled",
      "message": "source is disabled"
    },
    {
      "id": "ciyuancheng",
      "name": "ciyuancheng",
      "kind": "web",
      "tier": 2,
      "version": "2.0",
      "status": "disabled",
      "durationMs": 0,
      "category": "source_disabled",
      "message": "source is disabled"
    },
    {
      "id": "clicli",
      "name": "clicli",
      "kind": "web",
      "tier": 2,
      "version": "0.5",
      "status": "disabled",
      "durationMs": 0,
      "category": "source_disabled",
      "message": "source is disabled"
    },
    {
      "id": "cyfz",
      "name": "cyfz",
      "kind": "web",
      "tier": 2,
      "version": "1.0",
      "status": "disabled",
      "durationMs": 0,
      "category": "source_disabled",
      "message": "source is disabled"
    },
    {
      "id": "dalvdm",
      "name": "dalvdm",
      "kind": "web",
      "tier": 2,
      "version": "1.0",
      "status": "disabled",
      "durationMs": 0,
      "category": "source_disabled",
      "message": "source is disabled"
    },
    {
      "id": "dlma",
      "name": "dlma",
      "kind": "web",
      "tier": 2,
      "version": "1.1",
      "status": "disabled",
      "durationMs": 0,
      "category": "source_disabled",
      "message": "source is disabled"
    },
    {
      "id": "dm84",
      "name": "DM84",
      "kind": "web",
      "tier": 2,
      "version": "1.4",
      "status": "degraded",
      "durationMs": 0,
      "category": "unsupported_rule",
      "message": "source has no self-test request"
    },
    {
      "id": "dmand",
      "name": "dmand",
      "kind": "web",
      "tier": 2,
      "version": "1.1",
      "status": "disabled",
      "durationMs": 0,
      "category": "source_disabled",
      "message": "source is disabled"
    },
    {
      "id": "dmghg",
      "name": "dmghg",
      "kind": "web",
      "tier": 2,
      "version": "1.0",
      "status": "disabled",
      "durationMs": 0,
      "category": "source_disabled",
      "message": "source is disabled"
    },
    {
      "id": "dmhy",
      "name": "動漫花園",
      "kind": "bt",
      "tier": 3,
      "version": "1",
      "status": "healthy",
      "durationMs": 0
    },
    {
      "id": "dms",
      "name": "dms",
      "kind": "web",
      "tier": 2,
      "version": "1.0",
      "status": "disabled",
      "durationMs": 0,
      "category": "source_disabled",
      "message": "source is disabled"
    },
    {
      "id": "eacg",
      "name": "eacg",
      "kind": "web",
      "tier": 2,
      "version": "0.0.1",
      "status": "disabled",
      "durationMs": 0,
      "category": "source_disabled",
      "message": "source is disabled"
    },
    {
      "id": "enlie",
      "name": "enlie",
      "kind": "web",
      "tier": 2,
      "version": "1.0",
      "status": "disabled",
      "durationMs": 0,
      "category": "source_disabled",
      "message": "source is disabled"
    },
    {
      "id": "example-http",
      "name": "Example HTTP media",
      "kind": "web",
      "tier": 1,
      "version": "1",
      "status": "disabled",
      "durationMs": 0,
      "category": "source_disabled",
      "message": "source is disabled"
    },
    {
      "id": "example-rss",
      "name": "Example RSS releases",
      "kind": "bt",
      "tier": 3,
      "version": "1",
      "status": "disabled",
      "durationMs": 0,
      "category": "source_disabled",
      "message": "source is disabled"
    },
    {
      "id": "ezdmw",
      "name": "ezdmw",
      "kind": "web",
      "tier": 2,
      "version": "1.2",
      "status": "degraded",
      "durationMs": 0,
      "category": "unsupported_rule",
      "message": "source has no self-test request"
    },
    {
      "id": "fantuan",
      "name": "Fantuan",
      "kind": "web",
      "tier": 2,
      "version": "2.0",
      "status": "disabled",
      "durationMs": 0,
      "category": "source_disabled",
      "message": "source is disabled"
    },
    {
      "id": "fcdm",
      "name": "fcdm",
      "kind": "web",
      "tier": 2,
      "version": "1.0",
      "status": "disabled",
      "durationMs": 0,
      "category": "source_disabled",
      "message": "source is disabled"
    },
    {
      "id": "ffdm",
      "name": "ffdm",
      "kind": "web",
      "tier": 2,
      "version": "1.0",
      "status": "disabled",
      "durationMs": 0,
      "category": "source_disabled",
      "message": "source is disabled"
    },
    {
      "id": "fqdm",
      "name": "FQDM",
      "kind": "web",
      "tier": 2,
      "version": "2.0",
      "status": "disabled",
      "durationMs": 0,
      "category": "source_disabled",
      "message": "source is disabled"
    },
    {
      "id": "garden",
      "name": "Anime Garden",
      "kind": "bt",
      "tier": 3,
      "version": "1",
      "status": "healthy",
      "durationMs": 0
    },
    {
      "id": "girigirilove",
      "name": "giriGiriLove",
      "kind": "web",
      "tier": 2,
      "version": "2.4",
      "status": "disabled",
      "durationMs": 0,
      "category": "source_disabled",
      "message": "source is disabled"
    },
    {
      "id": "gpjda",
      "name": "gpjda",
      "kind": "web",
      "tier": 2,
      "version": "1.0",
      "status": "disabled",
      "durationMs": 0,
      "category": "source_disabled",
      "message": "source is disabled"
    },
    {